{
  "version": "1.0.0",
  "pillars": [
    { "id": "soberania", "label": "Soberanía" },
    { "id": "constitucion", "label": "Constitución" },
    { "id": "estado", "label": "Estado" }
  ],
  "types": [
    { "id": "concepto", "label": "Concepto" },
    { "id": "analisis", "label": "Análisis" },
    { "id": "norma", "label": "Norma" },
    { "id": "documento", "label": "Documento" },
    { "id": "cronologia", "label": "Cronología", "aliases": ["hecho"] },
    { "id": "historia", "label": "Historia" },
    { "id": "dossier", "label": "Dossier", "aliases": ["dosier"] }
  ],
  "statuses": [
    { "id": "verificado", "label": "Verificado" },
    { "id": "revision", "label": "En revisión" },
    { "id": "pendiente", "label": "Pendiente" }
  ],
  "norms": [
    {
      "id": "c40",
      "label": "Constitución de 1940",
      "aliases": ["C40", "Constitución del 40", "Constitución cubana de 1940"]
    },
    {
      "id": "codigo-electoral-1943",
      "label": "Código Electoral de 1943",
      "aliases": ["Código Electoral 1943", "Ley 17"]
    }
  ],
  "concepts": [
    { "id": "pueblo", "label": "Pueblo" },
    { "id": "soberania-popular", "label": "Soberanía popular" },
    { "id": "poder-constituyente", "label": "Poder constituyente" },
    { "id": "continuidad-juridica", "label": "Continuidad jurídica" },
    { "id": "legitimidad", "label": "Legitimidad" },
    { "id": "estado-de-derecho", "label": "Estado de derecho" }
  ]
}
